{
  "contradiction": 0.0,
  "corr": {
    "DeltaS,Lambda": 0.0,
    "E,Psi": 0.0,
    "E,T": 0.0,
    "T,Psi": 0.0
  },
  "mean": {
    "DeltaS": 0.0,
    "E": 1.0,
    "Es": 1.0,
    "Lambda": 0.0,
    "Psi": 1.0,
    "T": 1.0
  },
  "notes": "B then A then C: Es first, then Lambda, then T",
  "recommendations": [],
  "risk_band": {
    "ethical": "green",
    "lambda": "green",
    "traceability": "green"
  },
  "schema_id": "coherencelattice.state_estimate.v1",
  "sigma": {
    "DeltaS": 0.0,
    "E": 0.0,
    "Es": 0.0,
    "Lambda": 0.0,
    "Psi": 0.0,
    "T": 0.0
  },
  "t": "2026-01-09T05:29:32.511927+00:00",
  "version": 1
}